{
  "field": "dressing_centre_wavelength",
  "quantity": "length",
  "requirement": "required",
  "withoutThisField": "The optical period of the dressing field is unknown, so the streaking shift cannot be related to the vector potential and a reconstruction has no field frequency to assume.",
  "schema": {
    "type": "number",
    "exclusiveMinimum": 0
  }
}
