{
  "field": "subtracted_background_variance",
  "quantity": "none",
  "requirement": "optional",
  "withoutThisField": "The variance a background subtraction added cannot be given back, so every error bar in the low-count region is too small by an amount nobody can estimate.",
  "schema": {
    "type": "object",
    "required": [
      "how_obtained"
    ],
    "additionalProperties": false,
    "properties": {
      "how_obtained": {
        "type": "string",
        "minLength": 1,
        "pattern": "\\S"
      },
      "value": {
        "type": "number",
        "minimum": 0
      }
    }
  }
}
