{
  "field": "detector_angular_acceptance",
  "quantity": "none",
  "requirement": "optional",
  "withoutThisField": "How much of the angular distribution is averaged into each pixel is unknown, so a streaking amplitude reduced by angular averaging is read as a smaller field.",
  "schema": {
    "type": "object",
    "required": [
      "half_angle",
      "how_determined"
    ],
    "additionalProperties": false,
    "properties": {
      "half_angle": {
        "type": "number",
        "minimum": 0
      },
      "how_determined": {
        "type": "string",
        "minLength": 1,
        "pattern": "\\S"
      }
    }
  }
}
